{
  "$schema": "./schema/commands.schema.json",
  "version": 1,
  "hardWrite": [
    "rm",
    "rmdir",
    "unlink",
    "mv",
    "cp",
    "dd",
    "touch",
    "mkdir",
    "ln",
    "link",
    "chmod",
    "chown",
    "chgrp",
    "chattr",
    "setfacl",
    "truncate",
    "shred",
    "install",
    "mkfifo",
    "mknod",
    "mktemp",
    "fallocate",
    "rsync",
    "scp",
    "patch",
    "split",
    "csplit",
    "mount",
    "umount",
    "swapon",
    "swapoff",
    "vi",
    "vim",
    "nvim",
    "nano",
    "emacs",
    "ed",
    "ex",
    "kill",
    "pkill",
    "killall",
    "reboot",
    "shutdown",
    "poweroff",
    "halt"
  ],
  "packageManagers": {
    "names": [
      "npm",
      "pnpm",
      "yarn",
      "bun",
      "pip",
      "pip3",
      "pipx",
      "uv",
      "poetry",
      "cargo",
      "gem",
      "go",
      "mise",
      "composer"
    ],
    "writeSubcommands": [
      "install",
      "i",
      "add",
      "remove",
      "rm",
      "uninstall",
      "un",
      "update",
      "up",
      "upgrade",
      "ci",
      "publish",
      "link",
      "unlink",
      "sync",
      "get",
      "dedupe",
      "prune",
      "rebuild",
      "init",
      "create",
      "clean",
      "use",
      "generate"
    ]
  },
  "git": {
    "write": [
      "commit",
      "push",
      "pull",
      "fetch",
      "reset",
      "checkout",
      "switch",
      "restore",
      "rebase",
      "merge",
      "cherry-pick",
      "revert",
      "clean",
      "rm",
      "mv",
      "add",
      "apply",
      "am",
      "init",
      "clone",
      "gc",
      "prune",
      "repack",
      "update-ref",
      "update-index",
      "write-tree",
      "commit-tree",
      "filter-branch",
      "filter-repo",
      "format-patch",
      "bisect",
      "replace",
      "fast-import",
      "pack-refs",
      "maintenance",
      "sparse-checkout",
      "rerere",
      "checkout-index",
      "read-tree",
      "mergetool"
    ],
    "read": [
      "status",
      "log",
      "diff",
      "show",
      "blame",
      "ls-files",
      "ls-tree",
      "rev-parse",
      "describe",
      "shortlog",
      "grep",
      "cat-file",
      "rev-list",
      "for-each-ref",
      "show-ref",
      "name-rev",
      "merge-base",
      "count-objects",
      "check-ignore",
      "whatchanged",
      "range-diff",
      "cherry",
      "version",
      "help"
    ]
  },
  "wildcardSafe": [
    "ls",
    "tree",
    "cat",
    "head",
    "tail",
    "wc",
    "stat",
    "file",
    "jq",
    "yq",
    "grep",
    "egrep",
    "fgrep",
    "rg",
    "fd",
    "fdfind",
    "find",
    "du",
    "df",
    "uname",
    "whoami",
    "id",
    "date",
    "printenv",
    "which",
    "whereis",
    "realpath",
    "readlink",
    "basename",
    "dirname",
    "diff",
    "cmp",
    "comm",
    "md5sum",
    "sha1sum",
    "sha256sum",
    "sha512sum",
    "b2sum",
    "cksum",
    "hexdump",
    "od",
    "strings",
    "column",
    "cut",
    "tr",
    "nl",
    "fold",
    "rev",
    "tac",
    "paste",
    "sort",
    "lsblk",
    "lscpu",
    "lsusb",
    "lspci",
    "free",
    "uptime",
    "ps",
    "pgrep",
    "pstree",
    "echo",
    "printf",
    "seq",
    "bat",
    "eza",
    "exa",
    "delta",
    "difft",
    "tokei",
    "cloc",
    "scc",
    "ldd",
    "nm",
    "objdump",
    "readelf",
    "getent",
    "lsof",
    "locale",
    "zcat",
    "zgrep"
  ],
  "rtkReadSubcommands": ["read", "ls", "tree", "grep", "rg", "find", "wc", "stat", "jq", "json", "diff"]
}
